{
  "schemaVersion": "1.0",
  "waveId": "ES_KR_JP_OPEN_OFFICIAL_2026_07_28",
  "asOf": "2026-07-28",
  "status": "route_control_not_market_size",
  "purposeEn": "Credential-aware extraction control for official Spain, South Korea and Japan evidence. No route establishes annual consumer retail sales by itself.",
  "purposeFi": "Käyttöoikeudet huomioiva poimintakontrolli Espanjan, Etelä-Korean ja Japanin viralliseen näyttöön. Mikään reitti ei yksin osoita vuosittaista kuluttajavähittäismyyntiä.",
  "targetPeriods": [2022, 2023, 2024, 2025],
  "countryCount": 3,
  "countries": [
    {
      "countryIso2": "ES",
      "countryEn": "Spain",
      "countryFi": "Espanja",
      "routeState": "ready_with_scope_blocker",
      "marketValueStatus": "not_computed",
      "routes": [
        {
          "routeId": "ES_AEAT_2025_MODEL573_AGGREGATE_RECEIPTS",
          "role": "official_fiscal_observation",
          "status": "ready",
          "feeStatus": "free",
          "authority": "Agencia Estatal de Administración Tributaria",
          "sourceVersion": "AEAT_ANNUAL_REVENUE_REPORT_2025",
          "sources": [
            {
              "title": "AEAT annual revenue report 2025",
              "url": "https://sede.agenciatributaria.gob.es/Sede/estadisticas/recaudacion-tributaria/informe-anual/ejercicio-2025/1-ingresos-tributarios-2025/impuestos-devengados-ingresos-tributarios.html",
              "verifiedOn": "2026-07-28"
            },
            {
              "title": "AEAT Model 573 procedure",
              "url": "https://sede.agenciatributaria.gob.es/Sede/procedimientoini/DI10.shtml",
              "verifiedOn": "2026-07-28"
            },
            {
              "title": "Order HAC/86/2025",
              "url": "https://www.boe.es/buscar/doc.php?id=BOE-A-2025-1732",
              "verifiedOn": "2026-07-28"
            },
            {
              "title": "AEAT tax base and rates",
              "url": "https://sede.agenciatributaria.gob.es/Sede/impuestos-especiales-medioambientales/impuestos-especiales-fabricacion/liquidos-cigarrillos-electronicos-otros-productos-tabaco/base-imponible-tipo-gravamen.html",
              "verifiedOn": "2026-07-28"
            }
          ],
          "access": {
            "credentialRequired": false,
            "publicAggregateAvailable": true,
            "machineReadableFormat": "html",
            "feeRequired": false
          },
          "query": {
            "method": "GET",
            "endpoint": "https://sede.agenciatributaria.gob.es/Sede/estadisticas/recaudacion-tributaria/informe-anual/ejercicio-2025/1-ingresos-tributarios-2025/impuestos-devengados-ingresos-tributarios.html",
            "exactAnchor": "Impuesto sobre los Líquidos para Cigarrillos Electrónicos recaudó en su primer año 30 millones",
            "sourceFields": ["report_year", "amount_million_eur"],
            "transform": "amount_million_eur * 1000000"
          },
          "classification": {
            "system": "AEAT_MODEL_573",
            "version": "ORDER_HAC_86_2025",
            "aggregateCode": "ALL_EPIGRAPHS",
            "epigraphs": [
              {"code": "1", "scope": "e_liquid_without_nicotine_or_at_most_15_mg_ml", "rate": 0.15, "rateUnit": "EUR_PER_ML"},
              {"code": "2", "scope": "e_liquid_above_15_mg_ml", "rate": 0.20, "rateUnit": "EUR_PER_ML"},
              {"code": "3", "scope": "nicotine_pouches", "rate": 0.10, "rateUnit": "EUR_PER_GRAM"},
              {"code": "4", "scope": "other_nicotine_products", "rate": 0.10, "rateUnit": "EUR_PER_GRAM"}
            ]
          },
          "transactionStage": "realised_excise_cash_receipts",
          "flow": "tax_receipt",
          "outputMeasures": ["realised_excise_receipts_eur"],
          "coverage": {
            "sourcePeriod": 2025,
            "taxEffectiveFrom": "2025-04-01",
            "prospectiveOnly": true,
            "transitionalStockRulesPresent": true
          },
          "limitations": [
            "The EUR 30 million is aggregate Model 573 tax cash receipts, not consumer retail sales.",
            "The published aggregate does not split the four epigraphs, so it cannot be labelled e-liquid-only.",
            "The first-year observation begins in April 2025 and includes transitional stock rules; it is not a full-year comparable.",
            "Devices are outside this fiscal aggregate."
          ],
          "retailSalesEligible": false,
          "globalRollupEligible": false
        },
        {
          "routeId": "ES_AEAT_MODEL573_EPIGRAPH_QUANTITIES",
          "role": "quantity_and_scope_closure",
          "status": "blocked",
          "feeStatus": "not_applicable",
          "authority": "Agencia Estatal de Administración Tributaria",
          "sourceVersion": "MODEL_573_MONTHLY_SELF_ASSESSMENT_2025",
          "sources": [
            {
              "title": "AEAT Model 573 availability notice",
              "url": "https://www3.agenciatributaria.gob.es/Sede/impuestos-especiales-medioambientales/novedades-impuestos-especiales-medioambientales/2025/abril/30/impuesto-sobre-liquidos-cigarrillos-electronicos-573.html",
              "verifiedOn": "2026-07-28"
            }
          ],
          "access": {
            "credentialRequired": true,
            "publicAggregateAvailable": false,
            "machineReadableFormat": null,
            "feeRequired": false
          },
          "query": {
            "method": "taxpayer_filing_system",
            "endpoint": "https://sede.agenciatributaria.gob.es/Sede/procedimientoini/DI10.shtml",
            "exactFieldsNeeded": ["period", "epigraph", "taxable_ml_or_grams", "tax_due_eur"]
          },
          "classification": {
            "system": "AEAT_MODEL_573",
            "version": "ORDER_HAC_86_2025"
          },
          "transactionStage": "taxpayer_self_assessed_excise_base",
          "flow": "tax_base",
          "outputMeasures": [],
          "blockers": ["No public national epigraph-level aggregate or quantity table was located."],
          "limitations": ["Do not backsolve a product quantity from aggregate receipts while the epigraph mix is unknown."],
          "retailSalesEligible": false,
          "globalRollupEligible": false
        }
      ]
    },
    {
      "countryIso2": "KR",
      "countryEn": "South Korea",
      "countryFi": "Etelä-Korea",
      "routeState": "auth_and_historical_codebook_required",
      "marketValueStatus": "not_computed",
      "routes": [
        {
          "routeId": "KR_KCS_ITEMTRADE_HSK10",
          "role": "official_customs_proxy",
          "status": "auth_required",
          "feeStatus": "free",
          "authority": "Korea Customs Service",
          "sourceVersion": "ITEMTRADE_API_1.0.0_MODIFIED_2026_05_22",
          "sources": [
            {
              "title": "KCS item-level import and export performance OpenAPI",
              "url": "https://www.data.go.kr/data/15101609/openapi.do",
              "verifiedOn": "2026-07-28"
            },
            {
              "title": "KCS HS code file 20260101",
              "url": "https://www.data.go.kr/en/data/15049722/fileData.do",
              "verifiedOn": "2026-07-28"
            }
          ],
          "access": {
            "credentialRequired": true,
            "credentialType": "Public Data Portal serviceKey",
            "developmentApproval": "automatic",
            "publicAggregateAvailable": true,
            "machineReadableFormat": "xml",
            "feeRequired": false,
            "developmentTrafficLimit": 10000
          },
          "query": {
            "method": "GET",
            "baseUrl": "https://apis.data.go.kr/1220000/Itemtrade",
            "operationPath": "/getItemtradeList",
            "operationId": "getItemtradeList",
            "parameters": [
              {"name": "serviceKey", "required": true, "type": "string"},
              {"name": "strtYymm", "required": true, "type": "YYYYMM"},
              {"name": "endYymm", "required": true, "type": "YYYYMM"},
              {"name": "hsSgn", "required": false, "type": "HSK_2_4_6_OR_10_DIGITS"}
            ],
            "responseFields": ["year", "balPayments", "expDlr", "expWgt", "hsCode", "impDlr", "impWgt", "statKor"]
          },
          "classification": {
            "system": "HSK10",
            "version": "KCS_HS_CODE_20260101",
            "historicalVersionState": "blocked_pending_year_specific_validation_for_2022_2025",
            "codes": [
              {"code": "2404121000", "label": "Solutions for electronic cigarettes", "bucket": "nicotine_e_liquid", "decision": "candidate_included_current_codebook"},
              {"code": "2404129000", "label": "Other", "bucket": "other_nicotine_inhalation_products", "decision": "review_required"},
              {"code": "2404191000", "label": "Containing tobacco substitutes", "bucket": "other_noncombustion_products", "decision": "review_required"},
              {"code": "2404199010", "label": "Solutions for electronic cigarettes", "bucket": "other_e_cigarette_solution", "decision": "candidate_included_current_codebook"},
              {"code": "2404199090", "label": "Other", "bucket": "other_noncombustion_products", "decision": "review_required"},
              {"code": "8543401000", "label": "Containing products intended for inhalation without combustion of heading 24.04", "bucket": "device_with_heading_2404_product", "decision": "candidate_included_current_codebook"},
              {"code": "8543409000", "label": "Other", "bucket": "other_e_cigarette_device", "decision": "candidate_included_current_codebook"},
              {"code": "8543909000", "label": "Other parts", "bucket": "broad_parts", "decision": "excluded_until_scope_review"}
            ]
          },
          "transactionStage": "customs_border_declaration",
          "flow": "imports_cif_and_exports_fob",